{
  "runtime_contract_ref": "UPOS-11-ADAPTER-RESOLUTION",
  "runtime_contract_version": "0.1.0",
  "runtime_schema_version": "0.1.0",
  "validation_state": "VALID",
  "configuration_completeness": "COMPLETE",
  "evaluated_binding_refs": [
    "binding:B-REPO-WRITE"
  ],
  "missing_required_binding_refs": [],
  "validation_basis_refs": [
    "binding-validation:static",
    "binding-validation:runtime"
  ],
  "capability_support_state": "SUPPORTED"
}
